### ISSUE TITLE
authldap doesn't re-bind upon re-connection causing search and authentication to fail

### ISSUE THREAD

**Issue by stephane-chazelas** [svarshavchik/courier#66]
We've been happy users of courier-imap since 2008 (on Ubuntu 7.10 then, same server now running 20.04). We're in the process of migrating our user database from mysql to Microsoft Active Directory, so are switching authentication backend from `authmysql` to `authldap`.

Relevant configuration:

```
LDAP_URI                ldaps://dc01.example.com, ldaps://dc02.example.com
LDAP_PROTOCOL_VERSION   3
LDAP_BASEDN             OU=User,OU=Accounts,DC=example,DC=com
LDAP_BINDDN             CN=Email LDAP User,OU=Service,OU=Accounts,DC=example,DC=com
LDAP_BINDPW             **********
LDAP_TIMEOUT            5
LDAP_AUTHBIND           1
LDAP_INITBIND           1
LDAP_MAIL               sAMAccountName
LDAP_FILTER             (&(mail=*)(uidNumber>=10000)(uidNumber<=14999)(!(userAccountControl:1.2.840.113556.1.4.803:=2)))
LDAP_GLOB_UID           vmail
LDAP_GLOB_GID           vmail
LDAP_HOMEDIR            sAMAccountName
LDAP_MAILROOT           /var/vmail
LDAP_DEFAULTDELIVERY    defaultDelivery
LDAP_FULLNAME           cn
LDAP_AUXOPTIONS
LDAP_DEREF              never
LDAP_TLS                0
```

That works well except that every so often we get random authentication failures.

On such occurrences, logs have:

```
ldap_search_ext_s failed: Operations error
```

Network captures show a LDAPS connection to AD being dropped by AD upon that search and then we see a new one being established:

```
08:42:31.428012    TCP 74 54278 → 20389 [SYN] Seq=0 Win=65495 Len=0 MSS=65495 SACK_PERM=1 TSval=4201815003 TSecr=0 WS=128
08:42:31.428029    TCP 74 20389 → 54278 [SYN, ACK] Seq=0 Ack=1 Win=65483 Len=0 MSS=65495 SACK_PERM=1 TSval=4201815003 TSecr=4201815003 WS=128
08:42:31.428047    TCP 66 54278 → 20389 [ACK] Seq=1 Ack=1 Win=65536 Len=0 TSval=4201815003 TSecr=4201815003
08:42:31.428076    LDAP 293 searchRequest(1) "OU=User,OU=Accounts,DC=example,DC=com" wholeSubtree
08:42:31.428083    TCP 66 20389 → 54278 [ACK] Seq=1 Ack=228 Win=65280 Len=0 TSval=4201815003 TSecr=4201815003
08:42:31.438462    LDAP 240 searchResDone(1) operationsError (000004DC: LdapErr: DSID-0C090CE5, comment: In order to perform this operation a successful bind must be completed on the connection., data 0, v4563)  [0 results]
08:42:31.438475    TCP 66 54278 → 20389 [ACK] Seq=228 Ack=175 Win=65408 Len=0 TSval=4201815014 TSecr=4201815014
08:42:36.505993    LDAP 293 searchRequest(2) "OU=User,OU=Accounts,DC=example,DC=com" wholeSubtree
08:42:36.507731    LDAP 240 searchResDone(2) operationsError (000004DC: LdapErr: DSID-0C090CE5, comment: In order to perform this operation a successful bind must be completed on the connection., data 0, v4563)  [0 results]
08:42:36.507745    TCP 66 54278 → 20389 [ACK] Seq=455 Ack=349 Win=65408 Len=0 TSval=4201820083 TSecr=4201820083
08:42:36.507792    LDAP 73 unbindRequest(3)
08:42:36.507816    TCP 66 54278 → 20389 [FIN, ACK] Seq=462 Ack=349 Win=65536 Len=0 TSval=4201820083 TSecr=4201820083
08:42:36.508379    TCP 66 20389 → 54278 [FIN, ACK] Seq=349 Ack=463 Win=65536 Len=0 TSval=4201820084 TSecr=4201820083
08:42:36.508397    TCP 66 54278 → 20389 [ACK] Seq=463 Ack=350 Win=65536 Len=0 TSval=4201820084 TSecr=4201820084
```

(Don't mind the 20389 port, that's how we manage to intercept the LDAP traffic via `socat` for analysis).

Microsoft AD (rightfully) rejects the request because there haven't been any prior `bind()` on that reconnected socket.

That's on old versions of courier:

```
0.69.0-2build3 courier-authdaemon
0.69.0-2build3 courier-authlib
0.69.0-2build3 courier-authlib-ldap
1.0.6-1build2  courier-base
1.0.6-1build2  courier-base-dbgsym
1.0.6-1build2  courier-doc
5.0.6+1.0.6-1b courier-imap
2.1-3.1        libcourier-unicode4
```

And we're not able to upgrade at this point, but it looks like [the code](https://github.com/svarshavchik/courier/blob/master/courier-authlib/authldaplib.cpp#L654-L682) has not changed in that regard, where we see re-connection upon failure without a re-bind regardless of the value of `LDAP_INITBIND`.

For now, as a work around, we're doing a `touch authldaprc` every 5 minutes in an attempt to make sure the connections are short enough that Microsoft AD doesn't start dropping them randomly.
